link,class,Agenda Number,Agenda Item,Mayor Taylor,Disch (Ward 1),Harrison (Ward 1),Song (Ward 2),Watson (Ward 2),Radina (Ward 3),Ghazi-Edwin (Ward 3),Eyer (Ward 4),Akmon (Ward 4),Briggs (Ward 5),Cornell (Ward 5)
https://a2gov.legistar.com/LegislationDetail.aspx?ID=6505525&GUID=59F19469-9291-4A6D-B56F-0633E63A51E4&G=505481FE-B2ED-4B34-9A92-FDB26536D1E1&Options=&Search=,nomination pass,MC-1,Appointment - Confirmation,TRUE,TRUE,TRUE,TRUE,TRUE,TRUE,TRUE,TRUE,TRUE,TRUE,TRUE
https://a2gov.legistar.com/LegislationDetail.aspx?ID=6509118&GUID=89831AC5-A1B3-421F-8934-00D231B8A911&G=505481FE-B2ED-4B34-9A92-FDB26536D1E1&Options=&Search=,consent pass,CA-2,"Resolution Approving a Contract with the Shelter Association of Washtenaw County for the 2023 - 2024 Winter Emergency Shelter and Warming Center ($72,000.00)",TRUE,TRUE,TRUE,TRUE,TRUE,TRUE,TRUE,TRUE,TRUE,TRUE,TRUE
https://a2gov.legistar.com/LegislationDetail.aspx?ID=6509121&GUID=4E172B8B-4E4B-4087-8BD3-F77D015FA552&G=505481FE-B2ED-4B34-9A92-FDB26536D1E1&Options=&Search=,consent pass,CA-4,Resolution to Adopt the Ann Arbor Water Strategic Plan,TRUE,TRUE,TRUE,TRUE,TRUE,TRUE,TRUE,TRUE,TRUE,TRUE,TRUE
https://a2gov.legistar.com/LegislationDetail.aspx?ID=6509119&GUID=D8935F87-3359-48C7-9A2D-72F9E7DF79F9&G=505481FE-B2ED-4B34-9A92-FDB26536D1E1&Options=&Search=,consent pass,CA-5,"Resolution to Approve a Professional Services Agreement with OHM Advisors for Engineering Services for the Water Distribution Plan and Model Update ($604,797.00)",TRUE,TRUE,TRUE,TRUE,TRUE,TRUE,TRUE,TRUE,TRUE,TRUE,TRUE
https://a2gov.legistar.com/LegislationDetail.aspx?ID=6509123&GUID=07799DF0-5E34-4599-A3A9-C87DD85FEF4B&G=505481FE-B2ED-4B34-9A92-FDB26536D1E1&Options=&Search=,consent pass,CA-7,"Resolution to Approve Professional Services Agreements with DLZ Michigan, Inc. for $380,000.00; Intertek - Professional Service Industries, Inc. for $620,000.00; Materials Testing Consultants, Inc. for $830,000.00; and G2 Consulting Group, LLC for $300,000.00 for Construction Materials Testing Services",TRUE,TRUE,TRUE,TRUE,TRUE,TRUE,TRUE,TRUE,TRUE,TRUE,TRUE
https://a2gov.legistar.com/LegislationDetail.aspx?ID=6509125&GUID=55F89262-A18E-4527-802C-B08A334A3312&G=505481FE-B2ED-4B34-9A92-FDB26536D1E1&Options=&Search=,consent pass,CA-8,Resolution to Approve a Cost Allocation Agreement with the Regents of the University of Michigan for the East Medical Center Drive Bridge Rehabilitation and Widening Project,TRUE,TRUE,TRUE,TRUE,TRUE,TRUE,TRUE,TRUE,TRUE,TRUE,TRUE
https://a2gov.legistar.com/LegislationDetail.aspx?ID=6509130&GUID=1D38BB68-EAA8-4723-AE96-3832C8D2B8DA&G=505481FE-B2ED-4B34-9A92-FDB26536D1E1&Options=&Search=,consent pass,CA-9,"Resolution to Approve a Professional Services Agreement with Bodman, PLC for Legal Services to Support the City’s Participation in the 3M Company and DuPont PFAS Class Settlements and Appropriate Funds ($150,000.00)",TRUE,TRUE,TRUE,TRUE,TRUE,TRUE,TRUE,TRUE,TRUE,TRUE,TRUE
https://a2gov.legistar.com/LegislationDetail.aspx?ID=6509129&GUID=3ADDC13C-61C3-4F6B-9237-5C0E998E6035&G=505481FE-B2ED-4B34-9A92-FDB26536D1E1&Options=&Search=,consent pass,CA-10,Resolution to Approve the Updated Stipulation and Settlement Agreement in Michigan Public Service Commission Case No. U-21376 Regarding DTE’s Distributed Generation Tariff Options,TRUE,TRUE,TRUE,TRUE,TRUE,TRUE,TRUE,TRUE,TRUE,TRUE,TRUE
https://a2gov.legistar.com/LegislationDetail.aspx?ID=6509122&GUID=B483E361-A4C2-49A9-9A41-CCB4F266588D&G=505481FE-B2ED-4B34-9A92-FDB26536D1E1&Options=&Search=,consent rollcall pass,CA-3 - Motion to Approve as Amended by Briggs,Resolution to Approve the 333 E. William Street Development Agreement (CPC Recommendation: Approval - 6 Yeas and 0 Nays),TRUE,TRUE,TRUE,TRUE,TRUE,TRUE,TRUE,TRUE,TRUE,TRUE,TRUE
https://a2gov.legistar.com/LegislationDetail.aspx?ID=6509122&GUID=B483E361-A4C2-49A9-9A41-CCB4F266588D&G=505481FE-B2ED-4B34-9A92-FDB26536D1E1&Options=&Search=,consent rollcall amendment pass,CA-3 - Motion to Amend by Briggs,add direction to avoid closing the bike lane on William during construction. ,TRUE,TRUE,TRUE,TRUE,TRUE,TRUE,TRUE,TRUE,TRUE,TRUE,TRUE
https://a2gov.legistar.com/LegislationDetail.aspx?ID=6509126&GUID=99DD9915-A0C1-4A85-AD6D-454D6B2D47D0&G=505481FE-B2ED-4B34-9A92-FDB26536D1E1&Options=&Search=,consent rollcall fail,CA-1,"Resolution to Appropriate Funds and Approve a Golf Cart Lease with Golf Cars Plus ($796,050.00) and Appropriate Funding for the Purchase of Two Groundsmaster Mowers for Parks and Recreation ($48,921.00) (8 Votes Required)",TRUE,TRUE,TRUE,TRUE,TRUE,FALSE,FALSE,FALSE,FALSE,TRUE,FALSE
https://a2gov.legistar.com/LegislationDetail.aspx?ID=6509124&GUID=63E4F9A7-D2F9-477D-BFD1-EFF2F235C076&G=505481FE-B2ED-4B34-9A92-FDB26536D1E1&Options=&Search=,consent rollcall pass,CA-6,"Resolution to Approve the Appropriation of $140,000.00 from the General Fund Unobligated Fund Balance for the Design and Preparation of a Grant Application for the Pauline-Runnymede Path (8 Votes Required)",TRUE,TRUE,TRUE,TRUE,TRUE,TRUE,TRUE,TRUE,TRUE,TRUE,TRUE
https://a2gov.legistar.com/LegislationDetail.aspx?ID=6476016&GUID=CB2F4676-CB8B-4E82-A17D-86C4C6F4457E&G=505481FE-B2ED-4B34-9A92-FDB26536D1E1&Options=&Search=,ordinance pass,B-1 - Motion to Adopt on Second Reading by Disch,"An Ordinance to Amend Sections 5.20.3, 5.20.4 and 5.20.6 of Chapter 55 (Unified Development Code) of Title V of the Code of the City of Ann Arbor (Conflicting Land Use Buffer) - CPC Recommendation:  Approval (6 yes, 0 no) (ORD-24-02)",TRUE,TRUE,TRUE,TRUE,TRUE,TRUE,TRUE,TRUE,TRUE,TRUE,TRUE
https://a2gov.legistar.com/LegislationDetail.aspx?ID=6516922&GUID=DABF7458-A183-4F5A-A102-E77B6E06DF00&G=505481FE-B2ED-4B34-9A92-FDB26536D1E1&Options=&Search=,ordinance pass,C-1 - Motion to Approve on First Reading by Radina,An Ordinance to Amend Sections 8:530 and 8:531 of Chapter 105 (Housing Code) of Title VII (Building Regulations) of the Code of the City of Ann Arbor (ORD-24-03),TRUE,TRUE,TRUE,TRUE,TRUE,TRUE,TRUE,TRUE,TRUE,TRUE,TRUE
https://a2gov.legistar.com/LegislationDetail.aspx?ID=6516295&GUID=2E43A248-B6F5-4AC5-B90C-F0D4281B3CB2&G=505481FE-B2ED-4B34-9A92-FDB26536D1E1&Options=&Search=,resolution pass,DC-1,"Resolution to Approve a Legal Services Agreement with Rosati, Schultz, Joppich & Amtsbeuchler, PC Relative to City Projects Requiring the Acquisition of Easements or Other Property Interests ($150,000.00)",TRUE,TRUE,TRUE,TRUE,TRUE,TRUE,TRUE,TRUE,TRUE,TRUE,TRUE
https://a2gov.legistar.com/LegislationDetail.aspx?ID=6516858&GUID=5BCC9E66-F4A8-454F-A81E-69C87EC0D770&G=505481FE-B2ED-4B34-9A92-FDB26536D1E1&Options=&Search=,resolution pass,DC-2,Resolution in Support of Strengthening the City of Ann Arbor’s Fair Chance Hiring Practices,TRUE,TRUE,TRUE,TRUE,TRUE,TRUE,TRUE,TRUE,TRUE,TRUE,TRUE
https://a2gov.legistar.com/LegislationDetail.aspx?ID=6516942&GUID=D3588E0B-1336-4FCE-91AF-85113EBB9852&G=505481FE-B2ED-4B34-9A92-FDB26536D1E1&Options=&Search=,resolution pass,DS-1,"Resolution Authorizing Summary Publication of Ordinance 24-02 - An Ordinance to Amend Sections 5.20.3, 5.20.4 and 5.20.6 of Chapter 55 (Unified Development Code) of Title V of the Code of the City of Ann Arbor (Conflicting Land Use Buffer)",TRUE,TRUE,TRUE,TRUE,TRUE,TRUE,TRUE,TRUE,TRUE,TRUE,TRUE
