link,class,Agenda Number,Agenda Item,Mayor Taylor,Disch (Ward 1),Harrison (Ward 1),Song (Ward 2),Watson (Ward 2),Radina (Ward 3),Ghazi-Edwin (Ward 3),Eyer (Ward 4),Akmon (Ward 4),Briggs (Ward 5),Cornell (Ward 5)
https://a2gov.legistar.com/LegislationDetail.aspx?ID=6390843&GUID=83338B3E-2111-463E-B645-B5E1481DFB2B&G=505481FE-B2ED-4B34-9A92-FDB26536D1E1&Options=&Search=,nomination pass,MC-1,Appointments - Confirmations,TRUE,TRUE,TRUE,TRUE,TRUE,Absent,TRUE,TRUE,Absent,Absent,TRUE
https://a2gov.legistar.com/LegislationDetail.aspx?ID=6410940&GUID=9883515F-5C39-466A-AB92-92429C948C0C&G=505481FE-B2ED-4B34-9A92-FDB26536D1E1&Options=&Search=,consent pass,CA-1,"Resolution to Approve a Two (2) Year Construction Contract with Saladino Construction Co., Inc. for As-Needed Miscellaneous Concrete Repairs RFP 23-45 (up to $358,452.00 over two years)",TRUE,TRUE,TRUE,TRUE,TRUE,Absent,TRUE,TRUE,Absent,Absent,TRUE
https://a2gov.legistar.com/LegislationDetail.aspx?ID=6410942&GUID=952F1FA4-EC5A-4614-B5F3-0862F1C34F9F&G=505481FE-B2ED-4B34-9A92-FDB26536D1E1&Options=&Search=,consent pass,CA-2,"Resolution to Approve Amendment No.1 to the Annual Software Support, Maintenance and License Fees Agreement for AclaraONE with Aclara Technologies LLC ($19,420.82, Total Contract not to exceed $240,028.18)",TRUE,TRUE,TRUE,TRUE,TRUE,Absent,TRUE,TRUE,Absent,Absent,TRUE
https://a2gov.legistar.com/LegislationDetail.aspx?ID=6410943&GUID=231EDFA1-2F27-4875-9FBD-E9F721D75FB7&G=505481FE-B2ED-4B34-9A92-FDB26536D1E1&Options=&Search=,consent pass,CA-3,"Resolution to Authorize the Purchase of Seven Western Star Swap Loader Chassis with Underbody Snowplows and Eleven Swap Loader Bodies from D & K Truck Company and Appropriate Funding from the Stormwater Fund Balance (State of Michigan MiDeal - $2,384,164.69) (8 Votes Required)",TRUE,TRUE,TRUE,TRUE,TRUE,Absent,TRUE,TRUE,Absent,Absent,TRUE
https://a2gov.legistar.com/LegislationDetail.aspx?ID=6410945&GUID=5A681CB8-ED41-49C4-8834-32516DEC83A0&G=505481FE-B2ED-4B34-9A92-FDB26536D1E1&Options=&Search=,consent pass,CA-4,"Resolution to Accept a Water Main Easement at 721 S. Forest Avenue from Ann Arbor Forest Ave Properties KP6, LLC (8 Votes Required)",TRUE,TRUE,TRUE,TRUE,TRUE,Absent,TRUE,TRUE,Absent,Absent,TRUE
https://a2gov.legistar.com/LegislationDetail.aspx?ID=6410955&GUID=A99F41BD-C34F-4669-9A51-E7BA2BFCE102&G=505481FE-B2ED-4B34-9A92-FDB26536D1E1&Options=&Search=,consent pass,CA-5,Resolution to Accept a Water Main Easement at 715 S. Forest Avenue from 715 S. Forest L.L.C. (8 Votes Required),TRUE,TRUE,TRUE,TRUE,TRUE,Absent,TRUE,TRUE,Absent,Absent,TRUE
https://a2gov.legistar.com/LegislationDetail.aspx?ID=6410957&GUID=BB0C3C8B-D2F8-4683-ABFF-1479000E54C6&G=505481FE-B2ED-4B34-9A92-FDB26536D1E1&Options=&Search=,consent pass,CA-6,Resolution to Accept a Water Main Easement at 2195 E. Ellsworth Road from Lockwood of Ann Arbor Limited Dividend Housing Association Limited Partnership (8 Votes Required),TRUE,TRUE,TRUE,TRUE,TRUE,Absent,TRUE,TRUE,Absent,Absent,TRUE
https://a2gov.legistar.com/LegislationDetail.aspx?ID=6410959&GUID=974AFE6A-5236-40A1-9A5A-58EAA3D565ED&G=505481FE-B2ED-4B34-9A92-FDB26536D1E1&Options=&Search=,consent pass,CA-7,"Resolution to Approve an Agreement with Miller Canfield Paddock and Stone PLC for Bond and Disclosure Counsel Services, and General Municipal Finance Advice",TRUE,TRUE,TRUE,TRUE,TRUE,Absent,TRUE,TRUE,Absent,Absent,TRUE
https://a2gov.legistar.com/LegislationDetail.aspx?ID=6410944&GUID=F284FD3B-BA8D-414D-9810-D00E3CD3E777&G=505481FE-B2ED-4B34-9A92-FDB26536D1E1&Options=&Search=,consent pass,CA-9,"Resolution to Rescind R-23-182 for a Single Construction Contract with Melink Solar, LLC for the Purchase and Installation of Solar at City Facilities and its Appropriations and to Approve Four Construction Contracts with Melink Solar, LLC for the Purchase and Installation of Solar at City Facilities, and to Appropriate Necessary Funds (8 Votes Required)",TRUE,TRUE,TRUE,TRUE,TRUE,Absent,TRUE,TRUE,Absent,Absent,TRUE
https://a2gov.legistar.com/LegislationDetail.aspx?ID=6411033&GUID=938DA424-AF02-48FE-B6FA-4C95BF959814&G=505481FE-B2ED-4B34-9A92-FDB26536D1E1&Options=&Search=,consent pass,CA-10,"Resolution to Approve a Subrecipient Agreement with Midwest Geothermal, LLC for Technical Support and Design Guidelines as Part of the Bryant District Geothermal Project ($97,000)",TRUE,TRUE,TRUE,TRUE,TRUE,Absent,TRUE,TRUE,Absent,Absent,TRUE
https://a2gov.legistar.com/LegislationDetail.aspx?ID=6410958&GUID=7159628F-5CE5-419F-A1E0-D30886790B51&G=505481FE-B2ED-4B34-9A92-FDB26536D1E1&Options=&Search=,consent pass,CA-11,"Resolution to Accept and Appropriate a Community Project Funding Grant from the U.S. Department of Housing and Urban Development (HUD) for Enhancing Solar, Battery Storage, and Electric Vehicle Charging at Municipal Facilities ($2,500,000.00) (8 Votes Required)",TRUE,TRUE,TRUE,TRUE,TRUE,Absent,TRUE,TRUE,Absent,Absent,TRUE
https://a2gov.legistar.com/LegislationDetail.aspx?ID=6411034&GUID=91E86808-03F8-4D15-8354-7EF8660E335F&G=505481FE-B2ED-4B34-9A92-FDB26536D1E1&Options=&Search=,consent pass,CA-12,"Resolution to Approve a Professional Services Agreement with NOVA Consulting, Inc. to Design Solar and Energy Storage Systems at Multiple City Facilities ($135,000.00)",TRUE,TRUE,TRUE,TRUE,TRUE,Absent,TRUE,TRUE,Absent,Absent,TRUE
https://a2gov.legistar.com/LegislationDetail.aspx?ID=6411056&GUID=CD8EEC29-0603-4353-8622-799B8F88117F&G=505481FE-B2ED-4B34-9A92-FDB26536D1E1&Options=&Search=,consent pass,CA-13,"Resolution to Accept and Appropriate Michigan Office of Highway Safety Grant Funds and Approve the Subcontract Grant Agreement with the State Court Administrative Office ($99,000.00) (8 Votes Required)",TRUE,TRUE,TRUE,TRUE,TRUE,Absent,TRUE,TRUE,Absent,Absent,TRUE
https://a2gov.legistar.com/LegislationDetail.aspx?ID=6413332&GUID=304DBBD0-48B1-46A1-857D-4E36FC9BCBC0&G=505481FE-B2ED-4B34-9A92-FDB26536D1E1&Options=&Search=,consent pass,CA-14,Resolution to Adopt the Board of Review Guidelines for Poverty Exemptions from Property Taxation of Principal Residence Pursuant to MCL 211.7u,TRUE,TRUE,TRUE,TRUE,TRUE,Absent,TRUE,TRUE,Absent,Absent,TRUE
https://a2gov.legistar.com/LegislationDetail.aspx?ID=6411626&GUID=2EB2F3A2-2EAB-4CEB-9DA1-0EB2912D842E&G=505481FE-B2ED-4B34-9A92-FDB26536D1E1&Options=&Search=,consent rollcall pass,CA-8,"Resolution to Approve the City’s Participation in Proposed Class Settlements by 3M Company and DuPont to Resolve Claims by Public Water Systems Affected by PFAS Contamination in the matter In re: Aqueous Film-Forming Foams Products Liability Litigation, Multi-District Litigation No. 2:18-mn-2873-RMG",TRUE,TRUE,TRUE,TRUE,TRUE,Absent,TRUE,TRUE,Absent,Absent,TRUE
https://a2gov.legistar.com/LegislationDetail.aspx?ID=6372468&GUID=E57D885A-C4C8-4550-A692-DC7942828481&G=505481FE-B2ED-4B34-9A92-FDB26536D1E1&Options=&Search=,ordinance amendment pass,B-1 - Motion to Adopt on Second Reading by Disch,"An Ordinance to Amend Chapter 55 (Unified Development Code), Zoning of 5.23 Acres from TWP (Township) to PL (Public Land District), Vacant Traver Road (ORD-23-29)",TRUE,TRUE,TRUE,TRUE,TRUE,Absent,TRUE,TRUE,Absent,Absent,TRUE
https://a2gov.legistar.com/LegislationDetail.aspx?ID=6411032&GUID=DBA62C82-1E39-47FF-B5FC-EA982134213D&G=505481FE-B2ED-4B34-9A92-FDB26536D1E1&Options=&Search=,ordinance pass,C-1 - Motion to Approve on First Reading by Disch,"An Ordinance to Amend the Zoning Map, Being a Part of Section 5.10.2 of Chapter 55 of Title V of the Code of The City of Ann Arbor, Zoning of 5.9 Acres from TWP (Township District) to R4A (Multiple-Family Dwelling District), 2520 Pontiac Trail and 2540 Pontiac Trail (CPC Recommendation: Approval - 9 Yeas and 0 Nays) (ORD-23-34)",TRUE,TRUE,TRUE,TRUE,TRUE,Absent,TRUE,TRUE,Absent,Absent,TRUE
https://a2gov.legistar.com/LegislationDetail.aspx?ID=6417563&GUID=635BB369-5818-44FE-ABB3-74524A3B9E09&G=505481FE-B2ED-4B34-9A92-FDB26536D1E1&Options=&Search=,ordinance amendment pass,C-2 - Motion to Postpone at First Reading by Edwin,An Ordinance to Add Chapter 75 (Leaf Blowers) to Title VI of City Code,TRUE,TRUE,TRUE,TRUE,TRUE,Absent,TRUE,TRUE,Absent,TRUE,TRUE
https://a2gov.legistar.com/LegislationDetail.aspx?ID=6419293&GUID=F18F41B2-AFDC-4637-A067-25A32BB6ADE0&G=505481FE-B2ED-4B34-9A92-FDB26536D1E1&Options=&Search=,resolution pass,DC-1,Resolution to Approve 2024 Council Calendar,TRUE,TRUE,TRUE,TRUE,TRUE,Absent,TRUE,TRUE,Absent,TRUE,TRUE
